{
  "format": "minecraft-studio-model/1",
  "name": "control_panel",
  "texture_size": [
    16,
    16
  ],
  "textures": {
    "front": "resourcepack/assets/reactor/textures/item/panel_front.png",
    "side": "resourcepack/assets/reactor/textures/item/panel_side.png",
    "plate": "resourcepack/assets/reactor/textures/block/steel_plate.png"
  },
  "texture_refs": {
    "front": "reactor:item/panel_front",
    "side": "reactor:item/panel_side",
    "plate": "reactor:block/steel_plate"
  },
  "bones": [
    {
      "name": "panel",
      "pivot": [
        8,
        0,
        8
      ],
      "cubes": [
        {
          "name": "desk",
          "from": [
            1,
            0,
            3
          ],
          "to": [
            15,
            9,
            14
          ],
          "faces": {
            "north": {
              "texture": "side",
              "uv": [
                1,
                2,
                15,
                11
              ]
            },
            "south": {
              "texture": "side",
              "uv": [
                1,
                2,
                15,
                11
              ]
            },
            "east": {
              "texture": "side",
              "uv": [
                3,
                2,
                14,
                11
              ]
            },
            "west": {
              "texture": "side",
              "uv": [
                3,
                2,
                14,
                11
              ]
            },
            "up": {
              "texture": "plate",
              "uv": [
                1,
                3,
                15,
                14
              ]
            },
            "down": {
              "texture": "plate",
              "uv": [
                1,
                3,
                15,
                14
              ]
            }
          }
        },
        {
          "name": "console",
          "from": [
            1,
            9,
            2
          ],
          "to": [
            15,
            10,
            15
          ],
          "rotation": {
            "axis": "x",
            "angle": -22.5,
            "origin": [
              8,
              9,
              8
            ]
          },
          "faces": {
            "up": {
              "texture": "front",
              "uv": [
                15,
                14,
                1,
                1
              ]
            },
            "down": {
              "texture": "plate",
              "uv": [
                1,
                1,
                15,
                14
              ]
            },
            "north": {
              "texture": "plate",
              "uv": [
                1,
                0,
                15,
                1
              ]
            },
            "south": {
              "texture": "plate",
              "uv": [
                1,
                0,
                15,
                1
              ]
            },
            "east": {
              "texture": "plate",
              "uv": [
                2,
                0,
                15,
                1
              ]
            },
            "west": {
              "texture": "plate",
              "uv": [
                2,
                0,
                15,
                1
              ]
            }
          }
        },
        {
          "name": "screen_back",
          "from": [
            2,
            10,
            13
          ],
          "to": [
            14,
            16,
            15
          ],
          "faces": {
            "north": {
              "texture": "front",
              "uv": [
                2,
                2,
                14,
                8
              ]
            },
            "south": {
              "texture": "side",
              "uv": [
                2,
                2,
                14,
                8
              ]
            },
            "east": {
              "texture": "side",
              "uv": [
                2,
                2,
                4,
                8
              ]
            },
            "west": {
              "texture": "side",
              "uv": [
                2,
                2,
                4,
                8
              ]
            },
            "up": {
              "texture": "plate",
              "uv": [
                2,
                0,
                14,
                2
              ]
            },
            "down": {
              "texture": "plate",
              "uv": [
                2,
                0,
                14,
                2
              ]
            }
          }
        }
      ]
    }
  ],
  "display": {
    "gui": {
      "rotation": [
        30,
        225,
        0
      ],
      "translation": [
        0,
        0,
        0
      ],
      "scale": [
        0.625,
        0.625,
        0.625
      ]
    },
    "ground": {
      "rotation": [
        0,
        0,
        0
      ],
      "translation": [
        0,
        3,
        0
      ],
      "scale": [
        0.25,
        0.25,
        0.25
      ]
    },
    "fixed": {
      "rotation": [
        0,
        0,
        0
      ],
      "translation": [
        0,
        0,
        0
      ],
      "scale": [
        1,
        1,
        1
      ]
    },
    "thirdperson_righthand": {
      "rotation": [
        75,
        45,
        0
      ],
      "translation": [
        0,
        2.5,
        0
      ],
      "scale": [
        0.375,
        0.375,
        0.375
      ]
    },
    "firstperson_righthand": {
      "rotation": [
        0,
        45,
        0
      ],
      "translation": [
        0,
        0,
        0
      ],
      "scale": [
        0.4,
        0.4,
        0.4
      ]
    }
  }
}
